<?xml version="1.0" encoding="UTF-8" standalone="yes"?>
<job id="SillyJob-UnPartitionedDerby" xmlns:xsi="http://www.w3.org/2001/XMLSchema-instance" xsi:noNamespaceSchemaLocation="./slim-batch.xsd">
	<properties>
		<property name="NumberOfRows" value="10" type="int" />
		<property name="Partitions" value="1" type="int" />
	</properties>
	<listeners>
		<listener ref="SillyJobListener" />
	</listeners>
	<step id="SillyStep1">
		<transaction commitSize="20" datasource="dataSourceDerby" />
		<chunk items="10000" skips="100" retrys="10">
			<reader ref="SillyItemReader">
				<properties>
					<property name="Start" value="1" type="int" />
					<property name="End" value="10000" type="int" />
				</properties>
			</reader>
			<processor ref="SillyItemProcessor" />
			<writer ref="SillyItemWriter" />
		</chunk>
	</step>
	<step id="SillyStep2">
		<transaction commitSize="20" datasource="dataSourceDerby" />
		<chunk items="10000" skips="100" retrys="10">
			<reader ref="SillyItemReader">
				<properties>
					<property name="Start" value="10001" type="int" />
					<property name="End" value="20000" type="int" />
				</properties>
			</reader>
			<processor ref="SillyItemProcessor" />
			<writer ref="SillyItemWriter" />
		</chunk>
	</step>
	<step id="SillyStep3">
		<transaction commitSize="20" datasource="dataSourceDerby" />
		<chunk items="10000" skips="100" retrys="10">
			<reader ref="SillyItemReader">
				<properties>
					<property name="Start" value="20001" type="int" />
					<property name="End" value="50000" type="int" />
				</properties>
			</reader>
			<processor ref="SillyItemProcessor" />
			<writer ref="SillyItemWriter" />
		</chunk>
	</step>

</job>