<?xml version="1.0" encoding="UTF-8" standalone="yes"?>
<batch xmlns:xsi="http://www.w3.org/2001/XMLSchema-instance" xsi:noNamespaceSchemaLocation="./slim-batch.xsd">
	<!-- <placeholderProperties resource="/META-INF/batch-dev.properties" /> -->
<!-- 	<placeholderProperties resource="/META-INF/batch-prod.properties" /> -->
	<placeholderProperties resource="/META-INF/batch-test.properties" />
	<include resource="META-INF/beans.xml" />
<!-- 	<include resource="META-INF/batch-jobs/SlimBatch-SillyChunkJobDynamicPartitions.xml" /> -->
<!-- 	<include resource="META-INF/batch-jobs/SlimBatch-SillyChunkJobUnPartitioned.xml" /> -->
	<include resource="META-INF/batch-jobs/SlimBatch-SillyChunkJobDynamicPartitionsDerby.xml" />
	<include resource="META-INF/batch-jobs/SlimBatch-SillyChunkJobUnPartitionedDerby.xml" />
	<include resource="META-INF/batch-jobs/SlimBatch-SillyChunkJobDynamicPartitionsMySQL.xml" />
	<include resource="META-INF/batch-jobs/SlimBatch-SillyChunkJobUnPartitionedMySQL.xml" />

	<listener ref="SillyJobListener" />
	<datasource id="dataSource2" class="${batch.jdbc.driver}">
		<properties>
			<property name="URL" value="${batch.jdbc.url}" />
			<property name="ConnectionAttributes" value="${batch.jdbc.ConnectionAttributes}" />
			<!-- <property name="CreateDatabase" value="${batch.jdbc.CreateDatabase}" type="boolean" /> -->
			<property name="DatabaseName" value="${batch.jdbc.DatabaseName}" />
			<property name="User" value="${batch.jdbc.user}" />
			<property name="Password" value="${batch.jdbc.password}" />
		</properties>
	</datasource>

</batch>